{
  "deck_id": "DECK-TEST-003",
  "output_ref": "OUT-001",
  "title": "Test Deck - Violates MECE (duplicate points)",
  "audience": ["Test.Lead"],
  "slides": [
    {
      "slide_id": "S-001",
      "title": "Launch referral program by Nov 1 to grow pipeline 15%",
      "layout": "answer_first",
      "content": {"answer": "Approve 3-touch email sequence", "impact": "+15% pipeline", "owner": "Brand", "deadline": "2026-11-01"}
    },
    {
      "slide_id": "S-002",
      "title": "Situation: Referral channel flat at 3% of pipeline",
      "layout": "context",
      "content": {"metrics": ["3% pipeline from referrals"]}
    },
    {
      "slide_id": "S-003",
      "title": "Supporting arguments (MECE violation - duplicate point)",
      "layout": "mece_grouped",
      "content": {
        "groups": [
          {
            "label": "Demand generation",
            "points": ["Incentive unlocks latent advocate base", "Automation removes friction"]
          },
          {
            "label": "Sales execution",
            "points": ["Battlecard equips reps", "Automation removes friction"]
          }
        ]
      }
    },
    {
      "slide_id": "S-004",
      "title": "Next Steps & Decision Required",
      "layout": "decision",
      "content": {"ask": "Approve budget", "decision_deadline": "2026-10-15", "decision_maker": "Marketing.Head"}
    }
  ],
  "format": "markdown_slides",
  "generated_at": "2026-09-07T10:00:00Z"
}